,score,summary
247,0,"В Испании нашли мертвым бывшего замглавы совета директоров НОВАТЭКатела бывшего зампредседателя совета директоров новатэка протосени, его жены и дочери нашли в их доме в испании, куда семья отправилась на пасхальные праздники. по предварительной версии, мужчина совершил самоубийство"
248,1,"В «Энел Россия» сменился гендиректорим стала директор по правовым вопросам и корпоративным отношениям компании жанна седова, она сменит стефана мориса звегинцова. «энел россия» — российская генерирующая компания, «дочка» итальянской enel"
249,1,"В «Газпроме» предложили исключить валютную конкуренцию при поставках газатоп-менеджер компании кирилл полоус пояснил, что на рынке возникает валютная конкуренция между поставками трубопроводного газа и спг, поэтому введение механизма для ее исключения приобретает все более важное значение"
250,1,"В «Газпроме» заявили, что Siemens устранил четверть поломок на двигателяхзападные партнеры «газпрома» не выполняют обязательства по обслуживанию компрессорной станции «северного потока» «портовая», заявил зампред правления компании виталий маркелов в эфире канала «россия 24»."
251,1,В «Аэрофлоте» сменился гендиректорпредыдущий гендиректор авиакомпании михаил полубояринов покинул свой пост после попадания под санкции ес. источники рбк ранее называли александровского в качестве основной кандидатуры на должность
252,0,"В JPMorgan предупредили о нефти за $380 при предельных ценах для Россиианалитики предположили, что, если страны g7 введут лимит цен на российскую нефть, в москве ответят сокращением добычи: ее уменьшение на 5 млн б/с не нанесет большого ущерба российской экономике, но вызовет значительный рост цен"
254,0,"Британия ужесточила санкции против «Аэрофлота» и «России»лондон расширил санкции против трех российских авиаперевозчиков, запретив им продавать их неиспользованные слоты на взлет и посадку в британских аэропортах. в британии считают, что россия может получить от этого до £50 млн"
255,1,"Британия выдала лицензию на платежи за газ Газпромбанкувласти великобритании выдали попавшему под санкции газпромбанку лицензию, которая позволяет проводить платежи банку и его «дочкам» в рамках контрактов на поставку газа в евросоюз, свидетельствуют данные на сайте управления по осуществлению финансовых санкций страны (ofsi)."
256,0,"Британия ввела блокирующие санкции против МКБ и Сберамосковский кредитный банк попал под санкции великобритании впервые, в отношении сбербанка ужесточены ограничения."
257,0,"Болгария договорилась о покупке СПГ у США по ценам, ниже чем у «Газпрома»правительство болгарии не уточнило, по какой схеме будет рассчитываться стоимость газа при покупке у сша, и сколько она будет составлять. в конце апреля «газпром» остановил поставки в болгарию из-за неоплаты в рублях"
258,1,"Болгария договорилась о покупке СПГ у США по ценам ниже, чем у «Газпрома»правительство болгарии не уточнило, по какой схеме будет рассчитываться стоимость газа при покупке у сша и сколько она будет составлять. в конце апреля «газпром» остановил поставки в болгарию из-за неоплаты в рублях"
259,1,"Безос поддержал идею Маска сделать приют из штаб-квартиры Twitterилон маск поинтересовался у пользователей twitter, стоит ли сделать из штаб-квартиры компании приют для бездомных, поскольку «никто все равно [туда] не ходит». предложение одобрил основатель amazon"
260,1,"Банки увидели рост доли карт «Мир» после ухода Visa и Mastercardпо данным банков, доля платежей по картам «мир» в россии выросла, отвоевав позиции у visa и mastercard. после ухода западных систем у всех карт теперь один оператор. рост «мира» эксперты объясняют эмоциями и оплатами через телефон"
261,1,"Банки без головы // МКБ первым засекретил руководителя в базе ЕГРЮЛмосковский кредитный банк первым из подсанкционных банков воспользовался правом ограничения информации в егрюл о первом лице, хотя имя как минимум исполняющего обязанности руководителя банка известно — николай каторжнов. юристы указывают на уникальность примера, которому вряд ли в ближайшее время последуют другие кредитные организации."
262,1,"Аналитики ""Финама"" рекомендуют ""Покупать"" акции Capital Oneаналитики ""финама"" сохраняют позитивный взгляд на перспективы бизнеса capital one, несмотря на повышенные макроэкономические и другие риски. хотя сша формально скатились в рецессию, ситуация в экономике в целом остается неплохой и скорее говорит о реализации сценария ""мягкой посадки"". при этом во ii полугодии ожидается улучшение экономических показателей в стране. и на этом фоне capital one продолжит чувствовать себя относительно неплохо в финансовом плане.
целевая цена для акцийcapitaloneна июль 2023 г. составляет $136,6. потенциал роста от текущего ценового уровня равен 26,8%, что соответствует рейтингу ""покупать"".
capital oneактивно инвестирует в развитие цифровых технологий и считается самым технологичным банком в штатах. его операционная инфраструктура практически полностью переведена на облачную платформу aws, что позволило свести к минимуму использование традиционных дата-центров. приложения capital one в области цифрового банкинга считаются самыми продвинутыми в стране.
финансовый отчет capital one за 2квартал 2022 г. был не самым оптимистичным.чистая прибыль упала на 42,6% г/г, до $2 млрд, или $4,96 на акцию, и заметно не дотянула до средней оценки аналитиков уолл-стрит, хотя выручка увеличилась на 11,6% г/г, до $8,2 млрд, и совпала с консенсус-прогнозом.
аналитики ""финама""со сдержанным оптимизмом оцениваем долгосрочные перспективы capital one, несмотря на заметно выросшие в последнее время макроэкономические и другие риски. хотя ввп штатов в этом году сократился по итогам двух кварталов подряд, что соответствует формальному определению рецессии, ситуация в экономике, на наш взгляд, в целом остается неплохой и скорее говорит о реализации сценария ""мягкой посадки"". при этом во ii полугодии ожидается улучшение экономических показателей в стране. и на этом фоне capitalone, мы рассчитываем, продолжит чувствовать себя относительно неплохо в финансовом плане.
capital one, учитывая эффективную бизнес-модель банка, устойчивый баланс, хорошие позиции в сегменте кредитных карт и потребительском банкинге, сможет пройти непростой 2022 год без значительных потрясений и продолжит показывать положительный финансовый результат в предстоящие годы.
бизнес capital one, как и сектора в целом, сильно зависит от экономической и рыночной конъюнктуры.в случае ее дальнейшего существенного ухудшения можно ожидать снижения активности клиентов и спроса на продукты и услуги банка, возникновения убытков от переоценки инвестиционных портфелей, негативного влияния на показатели достаточности капитала."
263,0,Американский Arconic предупредил о потере $500 млн из-за завода в Самареамериканский производитель алюминиевых полуфабрикатов arconic объявил о планах продать свой завод в самаре из-за конфликта на украине. в результате сделки он может списать $500 млн
264,1,"Американская Whirlpool продаст российский бизнес турецкой Arcelikамериканский производитель бытовой техники простановил производство на двух своих заводах в липецке в начале марта. согласно соглашению с arcelik, российские активы компании будут проданы менее чем за €220 млн"
265,0,"Алмазы идут пеплом // Европейские ювелиры отказываются от продукции АЛРОСАна состоявшемся на днях в женеве крупнейшем часовом салоне мира watches & wonders несколько марок объявили, что приостанавливают закупки бриллиантов из российских алмазов. от них уже отказались такие известные бренды, как, например, cartier и tiffany & co. формально европейские санкции российского сырья не касаются и поставки не ограничены. марки делают это сами в знак протеста, и, как опасаются эксперты, их примеру могут последовать другие участники рынка. заменить российские алмазы непросто, и отказ от них вызовет рост цен, поставив одновременно под вопрос производственные планы алроса."
266,1,Алекперов покинул совет директоров ЛУКОЙЛа и пост главы компаниивагит алекперов покинул совет директоров лукойла и пост главы компании.
267,1,"Алекперов заявил, что останется в России после ухода из ЛУКОЙЛапо словам бывшего президента лукойла, он ушел из компании, чтобы санкции против него не мешали ее развитию. он останется в россии и продолжит инвестировать в социальные проекты"
268,0,"Акционеры обвинили Netflix в мошенничествеакционеры подали коллективный иск против стримингового сервиса netflix компании, они обвиняют копанию в публикации вводящего в заблуждения отчета о замедлении роста числа подписчиков для мошенничества с ценными бумагами, сообщают axios и reuters."
269,0,Акционеры ЛУКОЙЛа досрочно прекратили полномочия Алекпероваакционеры также досрочно прекратили полномочия вагита алекперова на посту президента лукойла
270,1,"Акционерам QIWI предложили дисконт // За отсутствие торгов и присутствие «ФК Открытие»компания сергея солонина предложила выкупить ценные бумаги qiwi у иностранных акционеров компании по $2,2–2,7 за акцию. торги ими на бирже nasdaq были остановлены больше четырех месяцев назад, и акционеры лишились возможности их продать. к тому же присутствие в числе акционеров qiwi попавшего под санкции российского банка «фк открытие» является для них негативным фактором. поэтому даже с учетом существенного дисконта к цене на московской бирже такой исход для держателей акций может оказаться выгодным."
271,0,"Акции Twitter упали на 11% на фоне отказа Маска от покупки соцсетиакции twitter упали на 11% на фоне того, что глава tesla и spacex илон маск отказался от сделки на покупку социальной сети за $44 млрд, передает телеканал cnbc."
272,1,Акрон: дорого на перспективуакрон: дорого на перспективу
273,0,"Адвокаты Маска призвали суд отложить разбирательство по иску Twitterадвокаты основателя tesla и spacex илона маска подали в суд ходатайство, в котором призвали отклонить запрос twitter о проведении ускоренного разбирательства по иску компании, сообщает bloomberg."
274,0,"Адвокатам предложили высокий приговор // По делу о хищении средств «Аэрофлота» прокуратура хочет жесткого наказанияпочти максимальное наказание в гагаринском суде москвы прокуратура потребовала для фигурантов уголовного дела о хищении средств компании «аэрофлот» на сумму около 250 млн руб. как утверждает обвинение, в договорах об оказании юридических услуг заместителем гендиректора «аэрофлота» владимиром александровым и руководителем департамента татьяной давыдовой были установлены завышенные расценки на работу внешних адвокатов дины кибец и александра сливко. прокуратура предложила каждого из обвиняемых приговорить к девяти годам колонии и оштрафовать на 1 млн руб. кроме того, надзорное ведомство потребовало удовлетворить гражданский иск к подсудимым на сумму более 120 млн руб. защита была шокирована предложением прокуратуры и намерена опровергнуть все доводы обвинения."
275,0,"Автора стратегии «Аэрофлота» заочно арестовали по делу о мошенничествесуд заочно арестовал бывшего замглавы «аэрофлота» андрея панова по делу о мошенничестве. обвинения касаются заказа на разработку маркетинговой стратегии компании. панов, уехавший из россии, называет их политически мотивированными"
276,0,"Австрия пригрозила забрать у «Газпрома» газохранилище в Зальцбургеавстрия может передать пхг haidach, которым управляет «дочка» gazprom germania, другим компаниям, если «газпром» откажется его заполнять, заявил канцлер, предложив действовать по принципу «используй или потеряешь»"
277,1,"Австрия передаст ПХГ «Газпрома» в Хайдахе другим поставщикамв австрии заявили, что «газпром» «систематически отказывается заполнять» крупнейшее газовое хранилище страны в хайдахе. его передадут другим энергетическим компаниям"
278,0,Австрийский партнер «Газпрома» списал €1 млрд из-за «Северного потока-2»убытки компании omv от прекращения участия в «северном потоке — 2» превысили 1 млрд евро. также компания потеря 658 млн евро от реклассификации других российских активов
279,0,"Австралия ввела санкции против «Газпрома», «Транснефти» и РЖДвласти австралии включили в санкционный список 13 российских юридических лиц, следует из документа, опубликованного на сайте правительства."
280,0,"Австралия ввела санкции против 39 россиян по делу Магнитскогопод санкции австралии попали 14 россиян, «ответственных за серьезную коррупцию», и еще 25 граждан россии, которые, по мнению канберры, причастны к смерти сергея магнитского"
281,0,"Австралия ввела санкции против 39 россиян по «делу Магнитского»под санкции австралии попали 14 россиян, «ответственных за серьезную коррупцию», и еще 25 граждан россии, которые, по мнению канберры, причастны к смерти сергея магнитского"
282,1,"«Яндекс», VK и Ozon решили претендовать на учет всей рекламы Рунетастать операторами рекламных данных, которые с осени должны передавать сведения обо всех кампаниях в рунете, готовы «яндекс», vk, ozon, мтс, «вымпелком» и структура нмг. для площадок их услуги могут оказаться небесплатными"
283,0,"«Совкомфлот»продаст часть судов«совкомфлот», один из мировых лидеров в сфере морских танкерных перевозок, планирует продать часть судов, сообщает компания."
284,0,"«Совкомфлот» сообщил о планах продать часть судов«совкомфлот», один из мировых лидеров в сфере морских танкерных перевозок, планирует продать часть судов, сообщает компания."
285,0,"«Ситуация — больше чем очередной экономический кризис» // Владелец НЛМК Владимир Лисин о последствиях конфликта на Украинероссийская экономика после начала боевых действий на украине и ввода санкций оказалась в новой реальности, и мало кто из крупных российских бизнесменов решается комментировать ее состояние. владелец нлмк владимир лисин, с позицией которого ознакомился “ъ”, называет ситуацию очень тяжелой и призывает правительство не ухудшать ее непродуманным регулированием."
286,0,«Северсталь» продала одну из крупнейших угледобывающих компаний Россиипокупателями «воркутаугля» стали бизнесмен роман троценко и экс-глава инвесткомпании а1 андрей тясто. перед сделкой троценко согласился уступить тясто контроль в их совместной компании
