,score,summary
116,0,"НПЗ заливает мазутом // ЛУКОЙЛ видит риски остановки заводов из-за избытка нефтепродуктовкак стало известно “ъ”, на фоне западных санкций крупные нефтекомпании, испытывающие серьезные проблемы с отгрузками топлива, могут столкнуться не только со снижением производства, но и с остановкой нпз. второй по величине российский нефтепереработчик лукойл ожидает таких последствий из-за нехватки мощностей для хранения мазута. чтобы избежать этого, компания хочет перенаправить избыток мазута на тэц и предлагает временно отменить высокие штрафы за негативное воздействие на экологию. такие же послабления нужны и для сжигания попутного нефтяного газа, которое, по мнению лукойла, может увеличиться из-за временной невозможности продавать за рубеж производимые из него сжиженные углеводородные газы (суг)."
117,1,НОВАТЭКу разрешили сохранить депозитарные расписки за рубежомкомпания избежит делистинга и сохранит программу глобальных депозитарных расписок на лондонской бирже. она подавала соответствующую заявку 5 мая
118,0,"НОВАТЭК заявил о проблемах с навигацией на Севморпути из-за санкций«новатэк» не может заказывать коммерческую съемку за рубежом из-за санкций, а большинство ведущих поставщиков — иностранные предприятия. россии необходимы свои спутники, так как снимков из открытых источников мало, сказал замглавы"
119,1,"НОВАТЭК заявил о готовности возобновить поставки в Польшеноватэк «будет защищать свои интересы в рамках действующего законодательства», сообщили в компании. ранее польша обязала ее передать свою газовую инфраструктуру государству"
120,1,"Мосбиржа переведет акции ""Селигдара"" на первый уровень листингамосковская биржа с 29 июля 2022 года переведет акции ""селигдара"" из раздела ""второй уровень"" в раздел ""первый уровень"" списка ценных бумаг, допущенных к торгам, сообщила торговая площадка. решение принято в связи с получением соответствующего заявления.
торги бумагами компании на мосбирже начались в 2011 году.
в первый уровень листинга включаются акции компаний, которые соответствуют правилам листинга московской биржи, в том числе требованиям к раскрытию информации, корпоративному управлению, размеру рыночной капитализации и количеству акций, находящихся в свободном обращении."
121,1,"Михельсон заявил об отсутствии проблем с запчастями для самолетов НОВАТЭКу иностранных самолетов новатэка пока нет проблем с запчастями, заявил его предправления леонид михельсон. ранее в правительстве не исключили разборку части воздушных судов на запчасти из-за западных санкций"
122,1,"Михельсон заявил о сотрудничестве с «Газпромом» по «моржам и медведям»миллер и михельсон договорились о сотрудничестве в арктике во вопросам экологии, но не совместной добычи газа. газопроизводство «все что-то никак», уточнил глава новатэка"
123,1,"Минцифры и VK анонсировали запуск магазина приложений RuStorerustore будет единственно законодательно урегулированным приложением, но другие маркетплейсы власти запрещать не планируют. все инвестиции на разработку российского магазина приложения осуществляет vk"
124,1,"Минфин сообщил о планах докапитализации ГПБ, РЖД и «Аэрофлота» из ФНБкапитал газпромбанка будет пополнен на 50 млрд руб. за счет фонда национального благосостояния, сообщил антон силуанов. средства фонда также направят на докапитализацию ржд, «дом.рф» и «аэрофлота»"
125,1,"Минфин предложил повысить НДПИ для «Газпрома» на 416 млрд руб.минфин предлагает внести поправки в статью 343 налогового кодекса о порядке исчисления и уплаты налога, согласно которой сумма ндпи для «газпрома» вырастет на 416 млрд руб."
126,1,Минфин поддержал идею «Газпрома» продавать СПГ за рублив «газпроме» указали на риск «валютной конкуренции» между поставками спг и трубопроводного газа: для продажи последнего «недружественным странам» уже несколько месяцев действует механизм оплаты в рублях
127,1,"Минфин допустил возобновление покупки алмазов у АЛРОСАгохран может вернуться к закупке алмазов у алроса, попавшей под западные санкции. последнюю крупную закупку он проводил в 2012 году"
128,1,"Минтранс назвал Ту-214 претендентом на базовый самолет «Аэрофлота»ту-214 – магистральный узкофюзеляжный самолет, разработанный в конце 1980-х. объединенная авиастроительная корпорация ранее анонсировала производство 70 таких лайнеров до 2030 года"
129,1,"Минпромторг разрешил параллельный импорт Apple, Bentley и PlayStationв него вошли, в частности, электроника, в том числе игровые приставки, мебель, оружие и боеприпасы, техника apple и samsung, часы, автомобили, суда, отопительное оборудование, оружие и ядерные реакторы"
130,0,"Минобороны обвинило Pfizer и Moderna в военных исследованиях на Украинев российском минобороны считают, что американские производители вакцин от коронавируса причастны к «военно-биологической деятельности сша на украине». ранее в минобороны заявляли о существовании на украине сети биолабораторий"
131,1,"Медведев счел, что Twitter не станет «снова демократичным» при Маскесоцсеть покупает американский бизнесмен илон маск. он обещал сделать twitter платформой с соблюдением свободы слова и внедрить механизмы защиты от спам-ботов с целью поддержки демократии"
132,0,"Маск, Рубини и Goldman Sachs предупредили о риске рецессии в СШАмиллиардер ожидает рецессию «в ближайшем будущем». по мнению экономиста рубини, предсказавшего глобальный кризис 2008 года, она наступит к концу года. вероятным спад экономики в ближайшие два года считают и в goldman sachs"
133,0,Маск сообщил в Twitter о приостановке сделки по покупке Twitterсделка по покупке соцсети twitter бизнесменом илоном маском приостановлена.
134,0,"Маск проверит 100 случайных аккаунтов в Twitter на подлинностькоманда американского бизнесмена, основателя tesla и spacex илона маска проведет проверку 100 случайных аккаунтов в twitter на подлинность."
135,1,"Маск предложил разблокировать Трампа в Twittertwitter заблокировал трампа и его соратников в январе 2021 года на фоне призывов к мирным протестам и штурма капитолия. экс-президент говорил, что лишился свободы слова. маск назвал это решение ошибкой"
136,1,"Маск предложил дать галочку верификации купившим подписку Twitter Blueбизнесмен илон маск, который недавно приобрел 9,2% акций twitter и вошел в совет директоров компании, предложил сделать подтвержденными учетные записи обладателей платной подписки twitter blut."
137,1,"Маск предложил выкупить все акции Twitter и сделать компанию частнойамериканский бизнесмен илон маск предложил выкупить все акции twitter, следует из документа, опубликованного на сайте комиссии по ценным бумагам и биржам сша."
138,1,"Маск предложил выкупить Twitter за $41 млрд и сделать компанию частнойамериканский бизнесмен илон маск предложил выкупить все акции twitter, следует из документа, опубликованного на сайте комиссии по ценным бумагам и биржам сша."
139,0,Маск подал встречный иск к Twitterмаск подал встречный иск к twitter
140,0,"Маск отказался покупать Twitterглава tesla и spacex илон маск отказался от сделки о покупке twitter из-за того, что социальная сеть не предоставила информацию о поддельных аккаунтах и спам-ботах, сообщает агентство reuters со ссылкой на заявление адвокатов миллиардера."
141,0,Маск ответил на «отравленную пилюлю» Twitter словами Love Me Tenderбизнесмен твитнул название песни love me tender после принятия советом директоров twitter мер по защите прав акционеров из-за предложения маска купить компанию. тендерное предложение предполагает приобретение напрямую у акционеров
142,0,"Маск обвинил Twitter в сокрытии от него данных о фейковых аккаунтахмиллиардер считает, что it-гигант препятствует его ознакомлению с информацией о существовавших в соцсети фальшивых учетных записях. ранее он приостановил сделку по покупке twitter до получения всех данных о фейковых страницах"
143,1,"Маск не исключил введения в Twitter платы для коммерческих пользователейпри этом соцсеть навсегда останется платной для обычных пользователей, заявил бизнесмен"
144,1,"Маск купил Twitter за $44 млрдамериканский предприниматель, основатель компании tesla договорился о приобретении социальной сети twitter за $44 млрд, передает reuters."
145,1,"Маск исключил покупку Twitter до получения отчета о числе страниц-фейковвчера генеральный директор twitter джек дорси отказался подтвердить, что число фейковых аккаунтов в соцсети не превышает 5%. пока он не сделает этого, сделка не будет закрыта, сказал маск. по его данным, их число достигает 20%"
146,1,"Маск заявил сотрудникам Twitter о необходимости «оздоровления» компанииилон маск предупредил сотрудников twitter, что компании необходимо «оздоровиться» и пройти «рационализацию численности персонала», выступая на запланированном собрании сотрудников по видеосвязи, сообщает financial times со ссылкой на источник, знакомый с ситуацией."
147,1,"Маск допустил введение в Twitter платы для бизнеса и госаккаунтовпри этом соцсеть навсегда останется бесплатной для обычных пользователей, заявил бизнесмен"
148,0,"Макс не исключил введения в Twitter платы для коммерческих пользователейtwitter может стать платным для коммерческих и государственных пользователей, сообщил американский предприниматель илон маск, который близок к завершению сделки по приобретению соцсети."
149,1,"Магнитогорцы не успели за «Трактором» // Клуб из Челябинска сравнял счет в полуфинале Кубка Гагаринавторой матч восточного полуфинала play-off кхл между «металлургом» и «трактором» завершился в пользу челябинского клуба — 6:4. как и в западном противостоянии ска и цска, счет в этой серии стал равным — 1:1."
151,1,"Магазины оценили объем запасов техники Apple и Samsungзапаса продукции техники от брендов, ограничивших свои поставки в россию, хватит на 2–3 месяца. для решения проблемы производители пытаются выстроить новые логистические цепочки, а власти планируют разрешить параллельный импорт"
152,1,"МТС смотрит ivi // Оператор хочет купить еще один видеосервискак стало известно “ъ”, мтс обсуждает покупку крупнейшего по выручке в рф онлайн-кинотеатра ivi. эксперты оценивают его на уровне $1–1,2 млрд. акционерам ivi сделка может позволить вернуть инвестиции в ситуации, когда не удалось провести запланированное ipo, а мтс — стать активным участником рынка онлайн-кинотеатров. собственный проект оператора kion за год работы, по данным аналитиков, так и не занял заметной доли."
153,1,"МТС произвела назначения в топ-менеджментемтс объявляет о новых назначениях в топ-менеджменте. на новую позицию члена правления, вице-президента по цифровым продуктам с 5 сентября назначается марина настасенко, переходящая в мтс с должности гендиректора компании ""салют для бизнеса"" из экосистемы ""сбербанка"".
также на новую должность директора по кибербезопасности в июле назначена евгения наумова, бывший исполнительный вице-президент по корпоративному бизнесу ""лаборатории касперского"".
и вице-президентом по взаимодействию с органами госвласти с 1 августа назначается андрей рего, ранее возглавлявший в мтс департамент регуляторной политики и взаимодействия с федеральными органами власти. прежний вице-президент по взаимодействию с органами госвласти, член правления мтс руслан ибрагимов покидает компанию в связи с истечением трудового договора.

"
154,1,МТС провела крупную закупку телеком-оборудования в первом кварталемтс почти на 30% увеличила капитальные затраты в первом квартале из-за ускорения закупок телекоммуникационного оборудования
155,1,МТС провела крупную закупку телеком оборудования в первом кварталемтс почти на 30% увеличила капитальные затраты в первом квартале из-за ускорения закупок телекоммуникационного оборудования
156,1,"МТС обслужит по лицу // Оператор запустил свой биометрический сервисклиенты мтс смогут получить услуги в салонах оператора без предъявления паспорта, если сдадут биометрию в систему компании. оператор рассчитывает, что так сможет удаленно обслуживать клиентов из любой точки мира. но конкуренты пока не разделяют оптимизм: в «мегафоне», например, считают услугу не слишком востребованной, а издержки — слишком высокими. в перспективе, чтобы развивать коммерческие биометрические системы, потребуется аккредитация минцифры, поэтому интерес к технологии дополнительно снизится, считают эксперты."
157,1,"МТС купила контроль в провайдере охранных систем «Гольфстрим» за ₽2 млрдмтс приобрела контроль в компании «гольфстрим охранные системы», специализирующейся на предоставлении услуг безопасности и «умного дома», говорится в сообщении пресс-службы мтс, поступившем в рбк."
158,1,"МТС и «Яндекс» не увидели проблем в работе суперкомпьютеров из-за Nvidianvidia перестала продлевать и продавать российским компаниям лицензии на свой софт. «коммерсантъ» написал, что этот шаг может осложнить работу суперкомпьютеров ряда российских компаний"
159,1,"МТС запустил продажу б/у смартфоновкомпания мтс начала продавать уцененные и бывшие в употреблении смартфоны, в интернет-магазине появилась соответствующая категория товаров."
160,0,"МИД внес в «стоп-лист» министров США, глав Universal Pictures и Netflixроссия вводит санкции против еще 61 американских граждан, в их числе главы и руководство минфина, минэнергетики, netflix, moodie's, nasdaq и fitch group. всего ограничительные меры москва ввела против 963 граждан сша"
161,0,"МИД внес в «стоп-лист» министров США и глав Universal Pictures и Netflixроссия вводит санкции против еще 61 американских граждан, в их числе главы и руководство минфина, минэнергетики, netflix, moodie's, nasdaq и fitch group. всего ограничительные меры москва ввела против 963 граждан сша"
162,1,"Льготам СПИК 1.0 продлевают срок // Регионы смогут рискнуть налогами ради инвестороввласти готовы продлить инвесторам проектов в рамках специнвестконтрактов первого поколения (спик 1.0) доступ к налоговым преференциям до окончания их реализации — по действующим условиям пониженные ставки действуют лишь до конца 2025 года. отчасти это связано с возможностью пролонгации самих контрактов из-за санкций и проблем с реализацией инвестпроектов. тем не менее полных данных о главном механизме импортозамещения минпромторга и, соответственно, числе попадающих под поправки контрактов и объеме выпадающих доходов бюджетов в правительстве нет. эксперты и рынок поправки поддерживают, особенно с учетом антикризисного перезапуска спик 1.0, но предостерегают от избыточных надежд на инструмент: во многом он был рассчитан на инвесторов из теперь уже «недружественных» стран."
