,score,summary
397,0,"Visa оценила убытки после ухода из Россииvisa приостановила свою деятельность в россии 10 марта. компания понесла убытки не только из-за деконсолидации российской «дочки», но и в связи с необходимостью поддерживать персонал"
398,1,"Visa от киргиза // Коммерческий банк Кыргызстана выдаст гражданам РФ международные картыкоммерческий банк кыргызстана готов выдавать гражданам рф работающие за рубежом карты visa без выезда за пределы страны. получить именую «золотую карточку» можно в офисе в москве за 17,5 тыс. руб. несмотря на удобство услуги по сравнению с тем же «карточным туризмом», в условиях санкций эксперты видят в ней риски как для потребителей, так и для банка."
399,1,"VK станет владельцем «Яндекс.Новости» и «Яндекс.Дзен»vk подписала соглашение о покупке сервисов «яндекса» — агрегатора новостей «яндекс.новости» и платформы для блогеров «яндекс.дзен», сообщили в пресс-службах обеих компаний."
400,1,"VK станет владельцем «Яндекс.Новостей» и «Яндекс.Дзена»vk подписала соглашение о покупке сервисов «яндекса» — агрегатора новостей «яндекс.новости» и платформы для блогеров «яндекс.дзен», сообщили в пресс-службах обеих компаний."
401,1,"VK стал владельцем «Яндекс.Новости» и «Яндекс.Дзен»vk подписала соглашение о покупке сервисов «яндекса» — агрегатора новостей «яндекс.новости» и платформы для блогеров «яндекс.дзен», сообщили в пресс-службах обеих компаний."
402,0,"VK списала ₽9,9 млрд из-за обесценивания доли «AliExpress Россия»vk списала почти 10 млрд руб. из-за обесценения доли в «aliexpress россия» на фоне экономической неопределенности. холдинг также не исключил сбои из-за нехватки оборудования, утечки данных и трудности с наймом персонала"
403,1,"VK отвергла планы продать разработчика игр из-за санкцийvk не планирует продавать собственное игровое подразделение my.games, планируется лишь переименование лишь одного из текущих юридических лиц, заявили рбк в пресс-службе компании."
404,1,"VK и Сбербанк продадут активы «Ситимобила» владельцу «Таксовичкоф»часть активов «ситимобила» — технологическую платформу сервиса, бренд и каналы привлечения клиентов — приобретет компания peoplepeople. сделку закроют во втором квартале 2022 года, ее сумма не раскрывается"
405,1,"VK и Сбербанк продадут активы «Ситимобил» владельцу «Таксовичкоф»o2o-холдинг — cовместное предприятие «сбера» и vk (бывшая mail.ru group) — продаст часть активов сервиса такси «ситимобил» управляющей компании peoplepeople (в ее портфель входят «грузовичкоф», «таксовичкоф» и другие компании), говорится в сообщении «сбера»."
406,1,"VK запустила сервис для совместного похода на мероприятиямосква, 28 июл - риа новости/прайм. онлайн-сервис ""vk знакомства"" запустил механизм поиска новых друзей или компании для похода на фестивали и конференции, функция работает в тестовом режиме - по запросу от организаторов мероприятий, сообщили риа новости в пресс-службе ""вконтакте"".
""онлайн-сервис ""vk знакомства"" первым в россии среди дейтинг-сервисов запустил механику поиска новых друзей или компании для похода на офлайн-фестиваль. новая функция помогает найти не только романтические, но и дружеские отношения, основанные на общих увлечениях... сейчас эта функция работает в тестовом режиме - по запросу от организаторов мероприятий. команда конференции или фестиваля может обратиться к нам прямо в сообщениях сообщества сервиса"", - отмечает компания.
уточняется, что подключение мероприятия к сервису может занять 3-5 дней. ""возможность работает в ручном режиме, так как нам важно, чтобы пользователям предлагались максимально интересные и полезные мероприятия"", - уточнили в компании.
впервые механика была опробована накануне vk fest 2022. пользователи vk знакомств получили возможность добавить в анкету специальную отметку ""иду на vk fest"" и привлечь внимание тех, кто тоже искал компанию, чтобы вместе пойти на мероприятие. каждый месяц ""vk знакомствами"" активно пользуется почти 2 миллиона человек."
407,1,"VEON остановил смену юрисдикции с Бермудских островов на Великобританиюveon собирался перерегистрировать головную компанию в юрисдикции «высокими стандартами корпоративного управления и прозрачной правовой базой». теперь процесс приостановлен, причины холдинг не озвучил"
408,0,"VEON остановил смену юрисдикции с Бермудских Островов на Великобританиюveon собирался перерегистрировать головную компанию в юрисдикции «высокими стандартами корпоративного управления и прозрачной правовой базой». теперь процесс приостановлен, причины холдинг не озвучил"
409,0,"VEON заявила об обесценивании бизнеса в России на $449 млн в I кварталев компании также оценили обесценивание активов на украине в $20 млн, связав это с ущербом от военных действий"
410,0,"VEON заявил об обесценивании бизнеса в России на $449 млн в I кварталев компании также оценили обесценивание активов на украине в $20 млн, связав это с ущербом от военных действий"
411,0,"Uniper сочла нарушением контракта объявление «Газпромом» форс-мажораобъявление «газпромом» форс-мажора по поставкам газа нарушает контрактные обязательства, заявил глава немецкого энергетического концерна uniper клаус-дитер маубах."
412,0,"Uber дальше не везет // Спецоперация проредила внесистемных кандидатов на муниципальных выборах в Москвеэкс-кандидат в госдуму от кпрф михаил лобанов и муниципальный депутат зюзино александр замятин запустили площадку для независимых кандидатов в районные депутаты москвы «выдвижение». с ее помощью оппозиционеры собираются противостоять на выборах тем кандидатам, которых поддержит мэрия. еще одну платформу — «штаб кандидатов» для «сохранения института независимых муниципальных депутатов» запустила команда экс-«яблочников». предполагается, что оба проекта будут помогать кандидатам юридически и информационно. масштабного «политического uber» по примеру системы, позволявшей на прошлых выборах кандидатам внесистемной оппозиции выдвигаться через «яблоко», не будет, да и локальные проекты сталкиваются с дефицитом кадров и демотивацией среди потенциальных кандидатов, которые собеседники “ъ” связывают со спецоперацией на территории украины."
413,1,"Twitter сообщил о работе над кнопкой редактирования твитовв ближайшие месяцы функцией смогут воспользоваться пользователи платной подписки twitter blue. в 2020 году бывший глава компании джек дорси говорил, что кнопка редактирования в соцсети, вероятно, не появится никогда"
414,0,"Twitter подаст в суд на Маска из-за отказа купить компанию за $44 млрдкомпания намерена обратиться в суд, чтобы сделка была закрыта на условиях, которые были согласованы с маском. согласно договоренностям, в случае срыва сделки бизнесмен должен заплатить $1 млрд неустойки"
415,0,"Twitter подаст в суд на Маскаtwitter подаст в суд на главу tesla и spacex илона маска, который отказался покупать соцсеть."
416,0,"Twitter подал в суд на Маска за отказ от покупки соцсетиtwitter потребовала через суд от главы tesla и spacex илона маска завершить сделку по приобретению социальной сети за $44 млрд, обвинив его в отказе выполнять обязательства перед платформой и ее акционерами, пишут the new york times и the guardian."
417,0,Twitter оштрафовали на 3 млн за неудаление рецептов «коктейлей Молотова»мировой суд таганского района москвы оштрафовал twitter на 3 млн руб.
418,0,"Twitter обвинили в неудалении публикаций об изготовлении бомбмировой суд москвы рассмотрит 28 апреля протокол об административном правонарушении против социальной сети twitter за неудаление информации, запрещенной в россии, сообщили рбк в пресс-службе таганского районного суда."
419,0,Twitter обвинил Маска в нарушении соглашения о неразглашениикомпания twitter обвинила американского бизнесмена илона маска в нарушении соглашения о неразглашении из-за инициированной проверки 100 разных аккаунтов соцсети.
420,0,"Twitter заплатит $150 млн штрафа из-за разглашения данных пользователейсоцсеть с мая 2013 года по сентябрь 2019 года вводила в заблуждение пользователей по поводу использования персональных данных, утверждают американские власти"
421,0,"Twitter заплатит $150 млн штрафа из-за введения в заблуждение людейсоцсеть с мая 2013 года по сентябрь 2019 года вводила в заблуждение пользователей по поводу использования персональных данных, утверждают американские власти"
422,0,"Twitter задействовал «отравленную пилюлю» для защиты от выкупа Маскомсовет директоров twitter принял меру, которая должна защитить компанию от «нежелательного и ни к чему не обязывающего» предложения илона маска о выкупе соцсети"
423,0,"TotalEnergies списала $3,5 млрд от обесценения своей доли в ""НОВАТЭКе""москва, 28 июл - риа новости/прайм. французская totalenergies решила зафиксировать убыток от обесценения своей доли в российской компании ""новатэк"" на общую сумму 3,5 миллиарда долларов, говорится в отчете компании.
""по состоянию на 30 июня 2022 года totalenergies зафиксировала в своей отчетности новый убыток от обесценения в размере 3 513 миллионов долларов сша, связанный в основном с потенциальным влиянием международных санкций на стоимость ее доли в ""новатэке"", - говорится в отчете.
компания напоминает, что по итогам первого квартала уже фиксировала убыток от обесценения в размере 4,095 миллиарда долларов, который в основном был связан с влиянием сложившейся ситуации на проект постройки производства сжиженного природного газа (спг) ""арктик спг 2"". с тех пор были введены новые санкции ес, создающие дополнительные риски для проекта, сообщается в отчете.
французская totalenergies (бывшая total) - одна из крупнейших энергетических компаний в мире, второй по величине поставщик спг на мировой рынок. штат сотрудников насчитывает около 100 тысяч человек более чем в 130 странах.
в россии компания владеет 19,4% в ""новатэке"", 20% в компании ""ямал спг"", 10% в компании ""арктик спг 2"", 10% в перевалочных терминалах в мурманске и на камчатке, 49% в сп ""тернефтегаз"". также компания владеет 20% в харьягинском срп, однако totalenergies согласилась передать эту долю ""зарубежнефти"".
*сообщение носит информационный характер, не является индивидуальной инвестиционной рекомендацией или предложением приобрести упомянутые ценные бумаги.приобретение иностранных ценных бумаг связано с дополнительными рисками"
424,0,"Total объявила о выходе из совместного с НОВАТЭКом проекта «Арктик СПГ 2»компания total прекратила инвестиции в проект «арктик спг-2». в компании объяснили это решение санкциями ес, введенными 8 апреля"
425,0,"The Verge узнал о жалобе сотрудников SpaceX на посты Маска в Twitterсотрудники spacex написали письмо с жалобой на поведение основателя компании илона маска на публике, так как это негативно сказывается на репутации предприятия, пишет издание the verge."
426,1,"The New York Times сообщила о визите двоих конгрессменов из США в Киевконгрессмены прибыли в киев из западной украины на поезде. они осмотрели соседние город бучу и село бородянка. о возможном визите в киев официальных лиц сша писала politico, затем информацию подтвердил президент сша джо байден"
427,1,"The Bell узнал о нежелании владельца Avito продавать компанию VKпо данным издания, vk предложил за покупку сервиса 65-80 млрд руб., в то время как нидерландская prosus оценивает актив в 213 млрд руб. кроме этого, владелец avito полагает, что vk «тестно связан с государством»"
428,0,"The Bell узнал о нежелании владельца Avito продавать его VKпо данным издания, vk предложил за покупку сервиса 65–80 млрд руб., в то время как нидерландская prosus оценивает актив в 213 млрд руб. кроме этого, владелец avito полагает, что vk «тесно связан с государством»"
429,1,"The Bell узнал о намерении VK купить онлайн-школу Skyengпри этом акционеры skyeng ведут переговоры и с другими крупными игроками рынка онлайн-образования, пишет издание"
430,0,"Siemens не выполняет ремонт двигателей для ""Северного потока"" - топ-менеджер ""Газпрома""москва, 27 июл - риа новости/прайм. siemens не выполняет работы по ремонту неисправных двигателей для ""северного потока"", сообщил зампред правления ""газпрома"" виталий маркелов.
""еще один вопрос связан с неисправными двигателями, которые находятся на компрессорной станции в состоянии вынужденного простоя из-за аварийных отказов. компания siemens не выполняет работ по устранению данных проблем"", - сказал он в эфире телеканала ""россия 24"".
""газпром"" 25 июля сообщил, что останавливает на компрессорной станции (кс) ""портовая"" - критически важном объекте для ""северного потока"" - эксплуатацию еще одного газотурбинного двигателя siemens. это связано с необходимостью отправить его на регламентный ремонт (в соответствии с предписанием ростехнадзора и с учетом технического состояния двигателя). теперь суточная производительность ""портовой"" не превышает 33 миллиона кубометров в сутки.

компания снизила поставки по магистрали с середины июня - сначала примерно до 60% от проектной мощности (не более 100 миллионов кубометров), а затем - до примерно 40% (не более 67 миллионов кубометров). тогда ""газпром"" объяснил это задержками в возврате газоперекачивающих агрегатов (гпа) для магистрали из ремонта с канадского завода (канада наложила на компанию санкции), выработкой у гпа межремонтного ресурса и техническими неисправностями двигателей.
"
431,0,"Shell сообщила об утрате контроля над СП с «Газпромом» «Салым Петролеум»англо-голландская shell отстранилась от управления сп с «газпром нефтью» — «салым петролеум девелопмент» и обнулила стоимость актива, следует из отчета компании."
432,0,"Shell слила российское топливо // Компания продала ЛУКОЙЛу свои заправки в странеshell, осудившая еще в марте действия россии на украине, продала лукойлу свой розничный бизнес из 411 азс в стране и завод смазочных материалов. это первый крупный актив в рф, от которого shell удалось избавиться в рамках поэтапного выхода. по оценке аналитиков, благодаря сделке доля заправок лукойла в ряде крупных регионов может превысить 30%. по мнению собеседников “ъ”, сделка прошла с дисконтом к рыночной цене и не содержит условий обратного выкупа активов."
433,0,"Shell оценила расходы от продажи АЗС и завода ЛУКОЙЛучистые расходы компании shell от продажи сети азс и завода смазочных материалов в торжке компании лукойл составили $83 млн, сообщается в квартальном отчете британско-нидерландской компании."
434,0,"Shell отошла от управления СП с «Газпром нефтью» «Салым петролеум»англо-голландская shell отстранилась от управления сп с «газпром нефтью» — «салым петролеум девелопмент» — и обнулила стоимость актива, следует из отчета компании."
435,0,Shell начала выводить сотрудников из совместных проектов с «Газпромом»shell объявила о решении продать доли в совместных предприятиях с «газпромом» в конце февраля. на минувшей неделе компания приступила к поэтапному выводу сотрудников из проектов
